{
  "approvedForPublication": false,
  "articleHash": "c33e7bb22ddf95aedb6e9469f84bdf32acd34204c671587260f2e7510815fcf8",
  "criticReviewHash": "ecece7fa6639682d0ffe46d72cd711f057363ad1fb875452f2f9b787602e526a",
  "criticReviewRef": "lab/reviews/php-language-foundation/critic-review.json",
  "criticVerdict": "PASS",
  "draftMetadataHash": "7aef1eb2459cd95a37974e0775f58d0d41e922d934f7ff8e8a87ca555a5ae8cd",
  "draftMetadataRef": "lab/drafts/php-language-foundation/article.json",
  "draftRef": "lab/drafts/php-language-foundation/article.md",
  "humanPublicationDecision": "pending",
  "preparedAt": "2026-10-16T13:26:23.257Z",
  "published": false,
  "readyForHumanPublicationDecision": true,
  "researchApproval": "lab/decisions/php-language-foundation-research-acceptance.json",
  "researchPacket": "lab/research/php-language-foundation/research.json",
  "reviewedDraft": {
    "action": "DRAFT",
    "approvedArtifacts": [
      {
        "path": "lab/decisions/b6-authorization.json",
        "sha256": "9dab6eba754cb3c93b250dd5ebcae11e014b88ad0958eab8a82e633fbcf82184"
      },
      {
        "path": "lab/decisions/php-language-foundation-source-decision.json",
        "sha256": "4df9629e4cecb3cc906cdc5dd3c68789904e508522d4401ca32e85e52b0e6c54"
      },
      {
        "path": "lab/cartography/php-language-foundation-single.json",
        "sha256": "09941e5a450c6b860d4e51350f9d397dcd8c4f67d025dc2543d41ad028920dea"
      },
      {
        "path": "lab/research/php-language-foundation/sources.json",
        "sha256": "d5d2de50a9aee4f4c23d3b9a4b7ff1f31d3e67c7d8049c990669a59dc3308778"
      },
      {
        "path": "lab/research/php-language-foundation/probes.json",
        "sha256": "c41bb88c8631d051ae03d4cb45e30904295bf73cd4a4853eee8ef87878a48b66"
      },
      {
        "path": "lab/research/php-language-foundation/research.json",
        "sha256": "be67729e55fb3c976b37c0fd048046cd9e95b5c7cf2731d134ebf0892c632e01"
      },
      {
        "path": "lab/research/php-language-foundation/runtime-verification.json",
        "sha256": "180a38c02bc7ab9778670c9ce9178dbf4a7a1d7ca5de99f4bcd22b376da94a32"
      },
      {
        "path": "lab/research/php-language-foundation/runtime-verification.md",
        "sha256": "1b3ff75faac98be37d87c5622defbf902f75d3808197cd82d493755691ca0127"
      }
    ],
    "articleHash": "c33e7bb22ddf95aedb6e9469f84bdf32acd34204c671587260f2e7510815fcf8",
    "audience": "beginner",
    "interactionOpportunities": [
      {
        "expectedConcept": "echo wypisuje podany napis.",
        "id": "predict-echo",
        "implemented": false,
        "prompt": "Co zobaczysz po uruchomieniu przykładu hello-cli?",
        "purpose": "Rozróżnić kod od wyniku.",
        "sectionId": "first-file",
        "type": "predict-output"
      },
      {
        "expectedConcept": "Zmiana liczby nie zmienia jej typu int.",
        "id": "change-value",
        "implemented": false,
        "prompt": "Zmień $count na 7 i przewidź wynik get_debug_type.",
        "purpose": "Zmienić wartość bez zmiany nazwy.",
        "sectionId": "values-and-variables",
        "type": "exercise"
      },
      {
        "expectedConcept": "Operator + tworzy nową wartość przypisaną do $total.",
        "id": "predict-sum",
        "implemented": false,
        "prompt": "Jaki będzie wynik po zmianie $second na 8?",
        "purpose": "Sprawdzić przypisanie wyniku działania.",
        "sectionId": "operators",
        "type": "predict-output"
      }
    ],
    "limitations": [
      "Zakres wykonania to lokalne PHP 8.2.4 CLI. Materiał nie omawia tablic, funkcji, formularzy, serwera WWW, deklaracji typów ani zgodności z innymi wersjami PHP."
    ],
    "researchApproval": "lab/decisions/php-language-foundation-research-acceptance.json",
    "researchPacket": "lab/research/php-language-foundation/research.json",
    "runtimeVerification": "lab/research/php-language-foundation/runtime-verification.json",
    "schemaVersion": 2,
    "sections": [
      {
        "body": "Zapisz kod w pliku `start.php`. W terminalu uruchom `php start.php`. Ten mały cykl jest ważny: najpierw zapisujesz program, potem sprawdzasz jego dokładny wynik. `echo` wypisuje tekst. Nie potrzebujesz do tego serwera WWW ani formularza.",
        "coverage": [
          "file-cli",
          "echo"
        ],
        "evidence": [
          {
            "id": "php-first-output",
            "kind": "finding"
          }
        ],
        "examples": [
          {
            "code": "<?php\necho \"Start PHP\\n\";",
            "expectedDiagnostics": [],
            "expectedOutput": "Start PHP\n",
            "id": "hello-cli",
            "language": "php",
            "purpose": "Pierwszy wynik z echo"
          }
        ],
        "heading": "Jeden plik i pierwszy wynik",
        "id": "first-file"
      },
      {
        "body": "Zmienna pozwala odwołać się do wartości przez nazwę. W PHP nazwa zmiennej zaczyna się od `$`. W tym przykładzie tekst, liczba i wartość logiczna są trzema prostymi wartościami scalar. `get_debug_type` pokazuje ich typ; to obserwacja, nie test poprawności całego programu.",
        "coverage": [
          "values",
          "variables",
          "scalar-types"
        ],
        "evidence": [
          {
            "id": "php-variable-name",
            "kind": "finding"
          },
          {
            "id": "php-scalar-types",
            "kind": "finding"
          }
        ],
        "examples": [
          {
            "code": "<?php\n$name = 'Ada';\n$count = 2;\n$ready = true;\necho $name, \"\\n\";\necho get_debug_type($count), \"\\n\";\necho get_debug_type($ready), \"\\n\";",
            "expectedDiagnostics": [],
            "expectedOutput": "Ada\nint\nbool\n",
            "id": "scalar-values",
            "language": "php",
            "purpose": "Trzy wartości i ich typy"
          }
        ],
        "heading": "Wartość ma nazwę",
        "id": "values-and-variables"
      },
      {
        "body": "Operator `+` dodaje wartości liczbowe. Zapis po prawej stronie przypisania jest obliczany, a wynik trafia do zmiennej po lewej stronie. Zmienna nie musi przechowywać wyłącznie liczby: wcześniej zapisana nazwa i obliczony wynik mogą zostać wypisane razem.",
        "coverage": [
          "arithmetic"
        ],
        "evidence": [
          {
            "id": "php-first-output",
            "kind": "finding"
          }
        ],
        "examples": [
          {
            "code": "<?php\n$first = 2;\n$second = 3;\n$total = $first + $second;\necho \"Suma: \", $total, \"\\n\";",
            "expectedDiagnostics": [],
            "expectedOutput": "Suma: 5\n",
            "id": "add-values",
            "language": "php",
            "purpose": "Suma zapisana pod nową nazwą"
          }
        ],
        "heading": "Operator tworzy nowy wynik",
        "id": "operators"
      }
    ],
    "sourceDecision": "lab/decisions/php-language-foundation-source-decision.json",
    "sources": [
      {
        "contentHash": "1378b639eb8e9bae3938be796aa4a95bd55edfcca54243b9c9c3ca6819be2ee9",
        "providedCharacters": 5240,
        "sourceId": "977",
        "sourcePath": "977-post-52-jakie-sa-php-i-python.md",
        "title": "Post #52 Jakie są PHP i Python",
        "truncated": false
      }
    ],
    "status": "draft",
    "targetRuntimes": [
      {
        "id": "php-cli",
        "kind": "cli",
        "version": "8.2.4 (cli) (built: Mar 14 2023 17:54:25) (ZTS Visual C++ 2019 x64)"
      }
    ],
    "title": "PHP od pierwszego skryptu: wartości, zmienne, typy, operatory i CLI",
    "topic": "php-language-foundation",
    "wordCount": 238,
    "writerExecution": {
      "inputHash": "e3c7abc7406cc6e76de63f12c1102c7563cacb5cae4fc680c43fad071b42ac03",
      "model": {
        "adapter": "recorded-json",
        "mode": "imported-session-analysis",
        "model": "codex-session"
      },
      "modelCalls": 1,
      "requestHash": "a3a3c6de6a71f75604d5ba5de8e04c0e82cbf96441e09b3a147b876d9a4042ff"
    }
  },
  "revisionHash": "400a6a08405340b28c138edafd568cc29192fe4be793daa01345fa87c5f1ba8f",
  "revisionRef": "lab/drafts/php-language-foundation/revision.json",
  "runtimeVerification": "lab/research/php-language-foundation/runtime-verification.json",
  "schemaVersion": 3,
  "sourceDecision": "lab/decisions/php-language-foundation-source-decision.json",
  "status": "publication-candidate",
  "targetRuntimes": [
    {
      "id": "php-cli",
      "kind": "cli",
      "version": "8.2.4 (cli) (built: Mar 14 2023 17:54:25) (ZTS Visual C++ 2019 x64)"
    }
  ],
  "title": "PHP od pierwszego skryptu: wartości, zmienne, typy, operatory i CLI",
  "topic": "php-language-foundation",
  "wordCount": 238
}
