{
  "approvedForPublication": false,
  "articleHash": "6d5442a749bb2d76b183fa7f26e423e0b6725d394b0779adf9f9219cecfc5fe7",
  "criticReviewHash": "7a3d6f8baae105f3e22cdb6d52fc2ddcb9cc92cf2be8faeb877278b1c89c6865",
  "criticReviewRef": "lab/reviews/curl-http-basics/critic-review.json",
  "criticVerdict": "PASS",
  "draftMetadataHash": "7c6c98e24ad71b5976ebc5836309a76c30d2b21662380bc32d83c086751903cf",
  "draftMetadataRef": "lab/drafts/curl-http-basics/article.json",
  "draftRef": "lab/drafts/curl-http-basics/article.md",
  "humanPublicationDecision": "pending",
  "preparedAt": "2026-10-13T19:41:48.383Z",
  "published": false,
  "readyForHumanPublicationDecision": true,
  "researchApproval": "lab/decisions/curl-http-basics-research-acceptance.json",
  "researchPacket": "lab/research/curl-http-basics/research.json",
  "reviewedDraft": {
    "action": "DRAFT",
    "approvedArtifacts": [
      {
        "path": "lab/decisions/b5-authorization.json",
        "sha256": "84ab1de07d38232a68fbea67500566f78156dc8c9d2e2c9dc8f86494cfeaf591"
      },
      {
        "path": "lab/decisions/curl-http-basics-rewrite.json",
        "sha256": "823ca534080e4254c027f2378f52d8dd13d62b685a6e5850c0a92ed87c62ed4b"
      },
      {
        "path": "lab/cartography/curl-http-basics-single.json",
        "sha256": "8b33cfb34cccef94639f37b7a9546695e8d91b5b82eb1f5f307168706a3902b2"
      },
      {
        "path": "lab/research/curl-http-basics/sources.json",
        "sha256": "8db24e57c65dec50d026a52c7b63c652eeee4ab3a10cca3fb6555e564c3e8796"
      },
      {
        "path": "lab/research/curl-http-basics/probes.json",
        "sha256": "544e4b411d047dca588575f1292fe6f5fc3b382ce7e4774074b4e6ddae068aba"
      },
      {
        "path": "lab/research/curl-http-basics/research.json",
        "sha256": "144402a67c9ed7f908e36e76d06fa691496a3126f4e8f8be7d856f5b58a93b1e"
      },
      {
        "path": "lab/research/curl-http-basics/runtime-verification.json",
        "sha256": "f95aea0ce4feb3fb237c3dce0439bf3563c81be3456a6ffd08f2bf5aedb61ee2"
      },
      {
        "path": "lab/research/curl-http-basics/runtime-verification.md",
        "sha256": "26a807da98eaa5dfd0ecd79d223811a063140b32e742fb663e58a989e6406eff"
      }
    ],
    "articleHash": "6d5442a749bb2d76b183fa7f26e423e0b6725d394b0779adf9f9219cecfc5fe7",
    "audience": "beginner / intermediate",
    "interactionOpportunities": [
      {
        "expectedConcept": "Jawny stan wejściowy prowadzi do obserwowalnego wyniku.",
        "id": "predict-output",
        "implemented": false,
        "prompt": "Przewidź dokładny wynik pierwszego wykonywalnego przykładu, a potem porównaj go z uruchomieniem.",
        "purpose": "Sprawdzić model mentalny przed uruchomieniem.",
        "sectionId": "get-body",
        "type": "predict-output"
      },
      {
        "expectedConcept": "Granice polecenia lub języka pozostają jawne.",
        "id": "change-boundary",
        "implemented": false,
        "prompt": "Zmień jedną wartość graniczną, zapisz przewidywanie i wykonaj przykład ponownie.",
        "purpose": "Samodzielnie sprawdzić przypadek graniczny.",
        "sectionId": "status-exit",
        "type": "exercise"
      }
    ],
    "limitations": [
      "Przykłady używają curl 8.13.0 na Windows i lokalnego serwera testowego; nie obejmują auth, cookies, proxy, pobierania plików ani zewnętrznych API."
    ],
    "researchApproval": "lab/decisions/curl-http-basics-research-acceptance.json",
    "researchPacket": "lab/research/curl-http-basics/research.json",
    "runtimeVerification": "lab/research/curl-http-basics/runtime-verification.json",
    "schemaVersion": 2,
    "sections": [
      {
        "body": "Polecenie `curl.exe` pozwala obejrzeć odpowiedź HTTP z terminala. Używamy jawnie nazwy `curl.exe`, aby w PowerShell nie pomylić programu z innym poleceniem lub aliasem. Odpowiedź ma kod statusu, nagłówki i opcjonalne body.\n\nW ćwiczeniu działa kontrolowany serwer pod `127.0.0.1:38421`. Trasa `/data` zwraca status 200 i mały dokument JSON, a `/missing` zwraca 404. Nie wysyłamy danych do zewnętrznego API.",
        "coverage": [
          "curl-command",
          "get-body",
          "http-status"
        ],
        "evidence": [
          {
            "id": "curl-body-headers",
            "kind": "finding"
          },
          {
            "id": "curl-status-output",
            "kind": "finding"
          }
        ],
        "examples": [],
        "heading": "Odpowiedź HTTP ma status, nagłówki i body",
        "id": "response-parts"
      },
      {
        "body": "Bez dodatkowej opcji curl wypisuje body odpowiedzi na standardowe wyjście. `--silent` usuwa pasek postępu, dzięki czemu wynik nadaje się do dalszego przetwarzania. Nie oznacza to jednak walidacji struktury JSON.",
        "coverage": [
          "get-body"
        ],
        "evidence": [
          {
            "id": "curl-body-headers",
            "kind": "finding"
          },
          {
            "id": "executed-boundaries",
            "kind": "finding"
          }
        ],
        "examples": [
          {
            "code": "curl.exe --silent http://127.0.0.1:38421/data",
            "expectedDiagnostics": [],
            "expectedOutput": "{\"name\":\"Ada\"}\n",
            "id": "curl-get-json",
            "language": "shell",
            "purpose": "Body z kontrolowanego endpointu JSON"
          }
        ],
        "heading": "GET i body JSON",
        "id": "get-body"
      },
      {
        "body": "`--include` dołącza nagłówki odpowiedzi do zwykłego body. `--head` dla HTTP wysyła metodę HEAD: ma semantykę GET, ale odpowiedź nie zawiera body. Nagłówki mogą opisywać reprezentację, którą zwróciłby GET.\n\nNie zakładaj, że każdy serwer zwróci identyczny zestaw ani kolejność nagłówków. Do automatycznego sprawdzania statusu lepiej użyć `--write-out` niż parsować pierwszą linię nagłówków.",
        "coverage": [
          "head-headers",
          "include"
        ],
        "evidence": [
          {
            "id": "curl-body-headers",
            "kind": "finding"
          }
        ],
        "examples": [],
        "heading": "Nagłówki: --include i --head",
        "id": "headers-head"
      },
      {
        "body": "`--write-out` wypisuje dane o zakończonym transferze. Zmienna `%{http_code}` daje kod statusu, nawet gdy body zapiszesz do `NUL`. Sam status 404 nie musi oznaczać niezerowego kodu wyjścia curl.\n\nJeżeli skrypt ma traktować odpowiedzi 400+ jako błąd procesu i zachować body diagnostyczne, użyj `--fail-with-body`. W takim przypadku curl kończy się kodem 22. To osobna informacja od statusu HTTP.",
        "coverage": [
          "write-out",
          "exit-code",
          "fail-with-body"
        ],
        "evidence": [
          {
            "id": "curl-status-output",
            "kind": "finding"
          },
          {
            "id": "curl-fail-body",
            "kind": "finding"
          },
          {
            "id": "curl-status-exit-separation",
            "kind": "finding"
          },
          {
            "id": "executed-boundaries",
            "kind": "finding"
          }
        ],
        "examples": [
          {
            "code": "curl.exe --silent --output NUL --write-out \"status=%{http_code}\" http://127.0.0.1:38421/missing",
            "expectedDiagnostics": [],
            "expectedOutput": "status=404",
            "id": "curl-http-status",
            "language": "shell",
            "purpose": "Sam status odpowiedzi bez body"
          }
        ],
        "heading": "Status HTTP i kod wyjścia procesu",
        "id": "status-exit"
      }
    ],
    "sourceDecision": "lab/decisions/curl-http-basics-rewrite.json",
    "sources": [
      {
        "contentHash": "354c16de83a9f44d0d924b3eea7e087f773b10b717bcb8781b47c3564ac43401",
        "providedCharacters": 9125,
        "sourceId": "1336",
        "sourcePath": "1336-post-64-curl-twoje-terminalowe-okno-na-swiat.md",
        "title": "Post #64 Curl – Twoje Terminalowe Okno na Świat",
        "truncated": false
      }
    ],
    "status": "draft",
    "targetRuntimes": [
      {
        "id": "curl",
        "kind": "cli",
        "version": "8.13.0"
      }
    ],
    "title": "curl i HTTP: odpowiedź, nagłówki i lokalny JSON",
    "topic": "curl-http-basics",
    "wordCount": 311,
    "writerExecution": {
      "inputHash": "2c6f8a57736aa6922030a3cbb83d2e8c55726d2ae97f288f46afee2802dae460",
      "model": {
        "adapter": "recorded-json",
        "mode": "imported-session-analysis",
        "model": "unknown-codex-session"
      },
      "modelCalls": 1,
      "requestHash": "fff247accd50d7c3ddcaff48094c7b69ccdc79028f02632fdd3affe33bbcb195"
    }
  },
  "revisionHash": "13067bcc5b1e10c82b417ccf79f097aa1d7c84e35ed1f78f43702b9a9f6debbc",
  "revisionRef": "lab/drafts/curl-http-basics/revision.json",
  "runtimeVerification": "lab/research/curl-http-basics/runtime-verification.json",
  "schemaVersion": 3,
  "sourceDecision": "lab/decisions/curl-http-basics-rewrite.json",
  "status": "publication-candidate",
  "targetRuntimes": [
    {
      "id": "curl",
      "kind": "cli",
      "version": "8.13.0"
    }
  ],
  "title": "curl i HTTP: odpowiedź, nagłówki i lokalny JSON",
  "topic": "curl-http-basics",
  "wordCount": 311
}
